{
  "schema": "banana-smasher.balanced64-window.v1",
  "suite_lock_sha256": "d5610f11c23b75f81e196e74407cb7e642a4f4a2e12f55925e13e5a7fe43ffb9",
  "teacher_source_model_index_sha256": "98efab455cf08dfbbbaaba6f570e1bf10bf927d2b4c3c453a59c2f6f0e3be92b",
  "candidate_artifact_sha256": "aaaaaaaaaaaaaaaaaaaaaaaaaaaaaaaaaaaaaaaaaaaaaaaaaaaaaaaaaaaaaaaa",
  "ordinal": 0,
  "window_id": 28,
  "source_class": "prose",
  "positions": 1,
  "kld_values": ["0.0"],
  "top1_matches": 1
}
